{
  "schema_version": 1,
  "source_revision": "d09efeceb898d5eb3791eb827a6a0d27f7f7699e",
  "components": [
    {
      "id": "api",
      "owner": "Control API",
      "packaged_in": [
        "infra/helm/limes-axis/templates/api-deployment.yaml"
      ]
    },
    {
      "id": "web",
      "owner": "Governance console",
      "packaged_in": [
        "infra/helm/limes-axis/templates/web-deployment.yaml"
      ]
    },
    {
      "id": "worker",
      "owner": "Workflow runtime",
      "packaged_in": [
        "infra/helm/limes-axis/templates/worker-deployment.yaml",
        "infra/docker/docker-compose.yml"
      ]
    },
    {
      "id": "postgres",
      "owner": "Operational persistence",
      "packaged_in": [
        "infra/docker/docker-compose.yml"
      ]
    },
    {
      "id": "valkey",
      "owner": "Rate-limit infrastructure",
      "packaged_in": [
        "infra/docker/docker-compose.yml"
      ]
    },
    {
      "id": "typedb",
      "owner": "Ontology runtime",
      "packaged_in": [
        "infra/docker/docker-compose.yml"
      ]
    },
    {
      "id": "temporal",
      "owner": "Workflow infrastructure",
      "packaged_in": [
        "infra/docker/docker-compose.yml"
      ]
    },
    {
      "id": "temporal-ui",
      "owner": "Workflow operations",
      "packaged_in": [
        "infra/docker/docker-compose.yml"
      ]
    },
    {
      "id": "minio",
      "owner": "Object storage",
      "packaged_in": [
        "infra/docker/docker-compose.yml"
      ]
    },
    {
      "id": "keycloak",
      "owner": "Identity infrastructure",
      "packaged_in": [
        "infra/docker/docker-compose.yml"
      ]
    }
  ],
  "dependencies": [
    {
      "id": "control-api",
      "owner": "Console/API transport",
      "components": [
        "web",
        "api"
      ],
      "purpose": "The console reads and mutates through the same tenant-bound control API, including liveness and readiness probes.",
      "settings": [
        "AXIS_API_BASE_URL",
        "NEXT_PUBLIC_AXIS_API_BASE_URL"
      ],
      "connections": [
        {
          "direction": "browser",
          "protocol": "https",
          "ports": [
            443
          ],
          "detail": "Browser-reachable API origin; local development uses port 8000."
        }
      ],
      "local_service": "axis-api",
      "local_replacement": {
        "status": "supported",
        "detail": "Serve the control API inside the deployment. The public web build embeds its API origin; changing only the container environment does not retarget that build."
      },
      "failure_behavior": "The console reports an unavailable or degraded API; a successful liveness probe alone is not readiness.",
      "evidence": [
        {
          "path": "apps/web/lib/api-status.ts",
          "kind": "source"
        },
        {
          "path": "apps/web/lib/axis-api.ts",
          "kind": "source"
        },
        {
          "path": "docs/development.md",
          "kind": "documentation"
        }
      ],
      "phases": [
        "runtime"
      ],
      "requirement": "required",
      "condition": ""
    },
    {
      "id": "console-origin",
      "owner": "Browser session boundary",
      "components": [
        "api",
        "web"
      ],
      "purpose": "Public console origin and permitted browser origins constrain login navigation and cross-origin requests. These are not autonomous API dial targets. The host cookie prefix is cookie-scope metadata; AXIS_CSRF_HOST_COOKIE_NAME is a web source constant naming the API-issued readable CSRF cookie, not an environment setting or remote host.",
      "settings": [
        "AXIS_PUBLIC_BASE_URL",
        "AXIS_CORS_ORIGINS",
        "AXIS_OIDC_SESSION_COOKIE_HOST_PREFIX",
        "AXIS_CSRF_HOST_COOKIE_NAME"
      ],
      "connections": [
        {
          "direction": "browser",
          "protocol": "https",
          "ports": [
            443
          ],
          "detail": "Browser navigation to the same locally hosted console; development uses port 3000."
        }
      ],
      "local_service": "axis-web",
      "local_replacement": {
        "status": "supported",
        "detail": "Host the console within the boundary and use matching public origins and identity callbacks."
      },
      "failure_behavior": "A wrong origin can prevent cross-origin or browser authentication flows; no alternate origin is admitted by this inventory.",
      "evidence": [
        {
          "path": "services/api/src/axis_api/settings/runtime.py",
          "kind": "source"
        },
        {
          "path": "services/api/src/axis_api/oidc_code_flow.py",
          "kind": "source"
        },
        {
          "path": "apps/web/lib/session-csrf.ts",
          "kind": "source"
        },
        {
          "path": "apps/web/lib/session-csrf.test.ts",
          "kind": "test"
        },
        {
          "path": "docs/development.md",
          "kind": "documentation"
        }
      ],
      "phases": [
        "runtime"
      ],
      "requirement": "required",
      "condition": ""
    },
    {
      "id": "operational-database",
      "owner": "Operational persistence",
      "components": [
        "api",
        "worker",
        "postgres",
        "temporal"
      ],
      "purpose": "Persist tenant-owned operational state and audit evidence. The packaged Temporal service also uses PostgreSQL.",
      "settings": [
        "AXIS_POSTGRES_DSN"
      ],
      "connections": [
        {
          "direction": "outbound",
          "protocol": "postgresql",
          "ports": [
            5432
          ],
          "detail": "Control-plane database and separately configured Temporal database schemas."
        }
      ],
      "local_service": "postgres",
      "local_replacement": {
        "status": "supported",
        "detail": "Use an operator-managed local PostgreSQL deployment. SQLite fixtures are not a production PostgreSQL substitute."
      },
      "failure_behavior": "Database-dependent requests, writes and workflow persistence cannot be assumed available. Backup and restore procedures remain separate evidence.",
      "evidence": [
        {
          "path": "services/api/src/axis_api/db.py",
          "kind": "source"
        },
        {
          "path": "services/api/src/axis_api/settings/persistence.py",
          "kind": "source"
        },
        {
          "path": "infra/docker/docker-compose.yml",
          "kind": "source"
        }
      ],
      "phases": [
        "runtime"
      ],
      "requirement": "required",
      "condition": ""
    },
    {
      "id": "distributed-rate-limit",
      "owner": "Policy admission",
      "components": [
        "api",
        "valkey"
      ],
      "purpose": "Share rate-limit admission across API processes through a Redis-compatible service.",
      "settings": [
        "AXIS_REDIS_URL"
      ],
      "connections": [
        {
          "direction": "outbound",
          "protocol": "redis",
          "ports": [
            6379
          ],
          "detail": "TLS and service port follow the selected Redis-compatible deployment."
        }
      ],
      "local_service": "valkey",
      "local_replacement": {
        "status": "supported",
        "detail": "Use local Redis or the packaged Valkey service. Production validation requires the Redis backend and closed failure mode."
      },
      "failure_behavior": "With the required production closed failure mode, unavailable admission storage rejects requests rather than falling back to an uncoordinated counter.",
      "evidence": [
        {
          "path": "services/api/src/axis_api/config.py",
          "kind": "source"
        },
        {
          "path": "services/api/src/axis_api/settings/policy.py",
          "kind": "source"
        },
        {
          "path": "services/api/tests/test_rate_limit.py",
          "kind": "test"
        },
        {
          "path": "infra/docker/docker-compose.yml",
          "kind": "source"
        }
      ],
      "phases": [
        "runtime"
      ],
      "requirement": "conditional",
      "condition": "Required for production; optional only where the existing configuration permits an in-memory development backend."
    },
    {
      "id": "ontology-store",
      "owner": "Ontology ports",
      "components": [
        "api",
        "typedb"
      ],
      "purpose": "Back separately enabled TypeDB ontology queries and mutations.",
      "settings": [
        "AXIS_TYPEDB_ADDRESS"
      ],
      "connections": [
        {
          "direction": "outbound",
          "protocol": "grpc",
          "ports": [
            1729
          ],
          "detail": "The packaged service also exposes a separate HTTP interface on container port 8000."
        }
      ],
      "local_service": "typedb",
      "local_replacement": {
        "status": "conditional",
        "detail": "Use local TypeDB for live graph operations. The Postgres reference graph is a limited reference path, not feature parity."
      },
      "failure_behavior": "Live TypeDB-dependent operations cannot complete when unavailable. Disabling those features is an explicit capability omission.",
      "evidence": [
        {
          "path": "services/api/src/axis_api/settings/persistence.py",
          "kind": "source"
        },
        {
          "path": "docs/architecture.md",
          "kind": "documentation"
        },
        {
          "path": "infra/docker/docker-compose.yml",
          "kind": "source"
        }
      ],
      "phases": [
        "runtime"
      ],
      "requirement": "conditional",
      "condition": "Enabled ontology query or mutation runtime; omit only with both capabilities disabled."
    },
    {
      "id": "workflow-engine",
      "owner": "Temporal adapter",
      "components": [
        "api",
        "worker",
        "temporal",
        "temporal-ui"
      ],